[
  {
    "timestamp": "2026-09-25T03:59:25.147879+00:00",
    "latitude": 22.9963,
    "longitude": 80.3143,
    "hazard_type": "flood",
    "severity": "moderate",
    "description": "Citizen observed emergency situation near milestone 0. Roads partially blocked.",
    "verified": true,
    "upvotes": 17,
    "media_url": "https://storage.disaster-platform.org/media/rep_0.jpg",
    "reporter_id": "user_0000"
  },
  {
    "timestamp": "2026-09-25T02:59:25.147879+00:00",
    "latitude": 27.6057,
    "longitude": 86.3641,
    "hazard_type": "wildfire",
    "severity": "critical",
    "description": "Citizen observed emergency situation near milestone 1. Roads partially blocked.",
    "verified": false,
    "upvotes": 8,
    "media_url": "https://storage.disaster-platform.org/media/rep_1.jpg",
    "reporter_id": "user_0001"
  },
  {
    "timestamp": "2026-09-25T01:59:25.147879+00:00",
    "latitude": 25.856,
    "longitude": 83.1436,
    "hazard_type": "wildfire",
    "severity": "severe",
    "description": "Citizen observed emergency situation near milestone 2. Roads partially blocked.",
    "verified": false,
    "upvotes": 8,
    "media_url": "https://storage.disaster-platform.org/media/rep_2.jpg",
    "reporter_id": "user_0002"
  },
  {
    "timestamp": "2026-09-25T00:59:25.147879+00:00",
    "latitude": 24.7893,
    "longitude": 85.0857,
    "hazard_type": "earthquake",
    "severity": "minor",
    "description": "Citizen observed emergency situation near milestone 3. Roads partially blocked.",
    "verified": false,
    "upvotes": 3,
    "media_url": "https://storage.disaster-platform.org/media/rep_3.jpg",
    "reporter_id": "user_0003"
  },
  {
    "timestamp": "2026-09-24T23:59:25.147879+00:00",
    "latitude": 21.2481,
    "longitude": 89.0757,
    "hazard_type": "landslide",
    "severity": "critical",
    "description": "Citizen observed emergency situation near milestone 4. Roads partially blocked.",
    "verified": true,
    "upvotes": 34,
    "media_url": "https://storage.disaster-platform.org/media/rep_4.jpg",
    "reporter_id": "user_0004"
  },
  {
    "timestamp": "2026-09-24T22:59:25.147879+00:00",
    "latitude": 21.248,
    "longitude": 82.4929,
    "hazard_type": "landslide",
    "severity": "critical",
    "description": "Citizen observed emergency situation near milestone 5. Roads partially blocked.",
    "verified": true,
    "upvotes": 4,
    "media_url": "https://storage.disaster-platform.org/media/rep_5.jpg",
    "reporter_id": "user_0005"
  },
  {
    "timestamp": "2026-09-24T21:59:25.147879+00:00",
    "latitude": 20.4647,
    "longitude": 84.1038,
    "hazard_type": "wildfire",
    "severity": "severe",
    "description": "Citizen observed emergency situation near milestone 6. Roads partially blocked.",
    "verified": false,
    "upvotes": 1,
    "media_url": "https://storage.disaster-platform.org/media/rep_6.jpg",
    "reporter_id": "user_0006"
  },
  {
    "timestamp": "2026-09-24T20:59:25.147879+00:00",
    "latitude": 26.9294,
    "longitude": 87.5555,
    "hazard_type": "earthquake",
    "severity": "minor",
    "description": "Citizen observed emergency situation near milestone 7. Roads partially blocked.",
    "verified": false,
    "upvotes": 41,
    "media_url": "https://storage.disaster-platform.org/media/rep_7.jpg",
    "reporter_id": "user_0007"
  },
  {
    "timestamp": "2026-09-24T19:59:25.147879+00:00",
    "latitude": 24.8089,
    "longitude": 82.288,
    "hazard_type": "earthquake",
    "severity": "moderate",
    "description": "Citizen observed emergency situation near milestone 8. Roads partially blocked.",
    "verified": true,
    "upvotes": 30,
    "media_url": "https://storage.disaster-platform.org/media/rep_8.jpg",
    "reporter_id": "user_0008"
  },
  {
    "timestamp": "2026-09-24T18:59:25.147879+00:00",
    "latitude": 25.6646,
    "longitude": 80.7698,
    "hazard_type": "landslide",
    "severity": "critical",
    "description": "Citizen observed emergency situation near milestone 9. Roads partially blocked.",
    "verified": true,
    "upvotes": 8,
    "media_url": "https://storage.disaster-platform.org/media/rep_9.jpg",
    "reporter_id": "user_0009"
  },
  {
    "timestamp": "2026-09-24T17:59:25.147879+00:00",
    "latitude": 20.1647,
    "longitude": 82.8975,
    "hazard_type": "earthquake",
    "severity": "severe",
    "description": "Citizen observed emergency situation near milestone 10. Roads partially blocked.",
    "verified": true,
    "upvotes": 36,
    "media_url": "https://storage.disaster-platform.org/media/rep_10.jpg",
    "reporter_id": "user_0010"
  },
  {
    "timestamp": "2026-09-24T16:59:25.147879+00:00",
    "latitude": 27.7593,
    "longitude": 81.6122,
    "hazard_type": "earthquake",
    "severity": "moderate",
    "description": "Citizen observed emergency situation near milestone 11. Roads partially blocked.",
    "verified": true,
    "upvotes": 35,
    "media_url": "https://storage.disaster-platform.org/media/rep_11.jpg",
    "reporter_id": "user_0011"
  },
  {
    "timestamp": "2026-09-24T15:59:25.147879+00:00",
    "latitude": 26.6595,
    "longitude": 89.297,
    "hazard_type": "earthquake",
    "severity": "critical",
    "description": "Citizen observed emergency situation near milestone 12. Roads partially blocked.",
    "verified": true,
    "upvotes": 9,
    "media_url": "https://storage.disaster-platform.org/media/rep_12.jpg",
    "reporter_id": "user_0012"
  },
  {
    "timestamp": "2026-09-24T14:59:25.147879+00:00",
    "latitude": 21.6987,
    "longitude": 88.0812,
    "hazard_type": "wildfire",
    "severity": "critical",
    "description": "Citizen observed emergency situation near milestone 13. Roads partially blocked.",
    "verified": true,
    "upvotes": 6,
    "media_url": "https://storage.disaster-platform.org/media/rep_13.jpg",
    "reporter_id": "user_0013"
  },
  {
    "timestamp": "2026-09-24T13:59:25.147879+00:00",
    "latitude": 21.4546,
    "longitude": 86.334,
    "hazard_type": "flood",
    "severity": "moderate",
    "description": "Citizen observed emergency situation near milestone 14. Roads partially blocked.",
    "verified": false,
    "upvotes": 22,
    "media_url": "https://storage.disaster-platform.org/media/rep_14.jpg",
    "reporter_id": "user_0014"
  },
  {
    "timestamp": "2026-09-24T12:59:25.147879+00:00",
    "latitude": 21.4672,
    "longitude": 88.7146,
    "hazard_type": "earthquake",
    "severity": "severe",
    "description": "Citizen observed emergency situation near milestone 15. Roads partially blocked.",
    "verified": true,
    "upvotes": 13,
    "media_url": "https://storage.disaster-platform.org/media/rep_15.jpg",
    "reporter_id": "user_0015"
  },
  {
    "timestamp": "2026-09-24T11:59:25.147879+00:00",
    "latitude": 22.4339,
    "longitude": 88.0367,
    "hazard_type": "flood",
    "severity": "severe",
    "description": "Citizen observed emergency situation near milestone 16. Roads partially blocked.",
    "verified": true,
    "upvotes": 30,
    "media_url": "https://storage.disaster-platform.org/media/rep_16.jpg",
    "reporter_id": "user_0016"
  },
  {
    "timestamp": "2026-09-24T10:59:25.147879+00:00",
    "latitude": 24.1981,
    "longitude": 81.8657,
    "hazard_type": "landslide",
    "severity": "severe",
    "description": "Citizen observed emergency situation near milestone 17. Roads partially blocked.",
    "verified": false,
    "upvotes": 19,
    "media_url": "https://storage.disaster-platform.org/media/rep_17.jpg",
    "reporter_id": "user_0017"
  },
  {
    "timestamp": "2026-09-24T09:59:25.147879+00:00",
    "latitude": 23.4556,
    "longitude": 88.9256,
    "hazard_type": "wildfire",
    "severity": "severe",
    "description": "Citizen observed emergency situation near milestone 18. Roads partially blocked.",
    "verified": true,
    "upvotes": 44,
    "media_url": "https://storage.disaster-platform.org/media/rep_18.jpg",
    "reporter_id": "user_0018"
  },
  {
    "timestamp": "2026-09-24T08:59:25.147879+00:00",
    "latitude": 22.3298,
    "longitude": 85.3934,
    "hazard_type": "flood",
    "severity": "minor",
    "description": "Citizen observed emergency situation near milestone 19. Roads partially blocked.",
    "verified": true,
    "upvotes": 38,
    "media_url": "https://storage.disaster-platform.org/media/rep_19.jpg",
    "reporter_id": "user_0019"
  },
  {
    "timestamp": "2026-09-24T07:59:25.147879+00:00",
    "latitude": 24.8948,
    "longitude": 88.0744,
    "hazard_type": "wildfire",
    "severity": "moderate",
    "description": "Citizen observed emergency situation near milestone 20. Roads partially blocked.",
    "verified": true,
    "upvotes": 5,
    "media_url": "https://storage.disaster-platform.org/media/rep_20.jpg",
    "reporter_id": "user_0020"
  },
  {
    "timestamp": "2026-09-24T06:59:25.147879+00:00",
    "latitude": 21.116,
    "longitude": 88.9609,
    "hazard_type": "cyclone",
    "severity": "moderate",
    "description": "Citizen observed emergency situation near milestone 21. Roads partially blocked.",
    "verified": true,
    "upvotes": 17,
    "media_url": "https://storage.disaster-platform.org/media/rep_21.jpg",
    "reporter_id": "user_0021"
  },
  {
    "timestamp": "2026-09-24T05:59:25.147879+00:00",
    "latitude": 22.3372,
    "longitude": 83.18,
    "hazard_type": "cyclone",
    "severity": "moderate",
    "description": "Citizen observed emergency situation near milestone 22. Roads partially blocked.",
    "verified": false,
    "upvotes": 4,
    "media_url": "https://storage.disaster-platform.org/media/rep_22.jpg",
    "reporter_id": "user_0022"
  },
  {
    "timestamp": "2026-09-24T04:59:25.147879+00:00",
    "latitude": 22.9309,
    "longitude": 81.1005,
    "hazard_type": "cyclone",
    "severity": "moderate",
    "description": "Citizen observed emergency situation near milestone 23. Roads partially blocked.",
    "verified": true,
    "upvotes": 18,